[
 {
  "n": "South Kamloops Secondary (SKSS)",
  "c": "school",
  "g": "sk",
  "lat": 50.666343,
  "lng": -120.320712,
  "a": "821 Munro St",
  "p": "250-374-1405",
  "w": "https://www.sd73.bc.ca/skss",
  "h": {
   "r": [
    [
     1,
     5,
     420,
     990,
     0
    ]
   ],
   "q": "qOffice"
  },
  "note": {
   "zh": "有法语沉浸项目和AP课程",
   "en": "French immersion programme and AP courses",
   "fr": "Programme d'immersion française et cours AP",
   "es": "Programa de inmersión en francés y cursos AP",
   "ko": "프랑스어 몰입 과정과 AP 과정",
   "ja": "フランス語イマージョン課程とAP課程あり"
  },
  "src": "official",
  "v": "2026-10",
  "t": [
   "family"
  ],
  "id": "3aa4eac6"
 },
 {
  "n": "Lloyd George Elementary",
  "c": "elem",
  "g": "sk",
  "lat": 50.6698217,
  "lng": -120.3205248,
  "a": "830 Pine St",
  "p": "250-374-3174",
  "w": "https://www.sd73.bc.ca/lg",
  "note": {
   "zh": "<b>K–7 法语沉浸式（French Immersion）小学</b>，不是普通英语授课的学区小学；毕业后升入 South Kamloops Secondary。上课和办公时间各校不同，也会随学年变化——去之前先打电话或看学校网页确认。",
   "en": "<b>A K–7 French Immersion school</b>, not a regular English-program neighbourhood school; it feeds into South Kamloops Secondary. Office hours and bell times differ by school and change from year to year — call the school or check its page before you go.",
   "fr": "<b>École d’immersion française de la maternelle à la 7e année</b>, et non une école de quartier au programme anglais ordinaire ; elle mène à South Kamloops Secondary. Les heures de bureau et les horaires de classe varient d’une école à l’autre et changent d’une année à l’autre — téléphonez à l’école ou consultez sa page avant de vous déplacer.",
   "es": "<b>Escuela de inmersión en francés de K a 7.º</b>, no una escuela de barrio con el programa normal en inglés; sus alumnos pasan a South Kamloops Secondary. El horario de oficina y el de clases varían según la escuela y cambian cada año: llame a la escuela o consulte su página antes de ir.",
   "ko": "<b>K–7 프랑스어 몰입(French Immersion) 학교</b>로, 일반 영어 과정 동네 학교가 아닙니다. 졸업 후 South Kamloops Secondary로 진학합니다. 사무실 운영 시간과 수업 시간은 학교마다 다르고 해마다 바뀝니다 — 가기 전에 학교에 전화하거나 홈페이지를 확인하세요.",
   "ja": "<b>K〜7年生のフランス語イマージョン校</b>で、通常の英語課程の地域校ではありません。卒業後はSouth Kamloops Secondaryに進みます。事務室の受付時間や授業時間は学校ごとに異なり、年度によっても変わります — 行く前に学校に電話するか、学校のページで確認してください。"
  },
  "src": "official",
  "v": "2026-10",
  "t": [
   "family"
  ],
  "id": "d5d9e41f",
  "pick": 1
 },
 {
  "n": "Royal Inland Hospital",
  "c": "hospital",
  "g": "sk",
  "lat": 50.6703494,
  "lng": -120.3335214,
  "a": "311 Columbia St",
  "p": "250-374-5111",
  "w": "https://www.interiorhealth.ca/locations/royal-inland-hospital",
  "h": {
   "a": true
  },
  "note": {
   "zh": "本市主医院，设有急诊科",
   "en": "The main hospital, with an emergency department",
   "fr": "L'hôpital principal, avec un service d'urgence",
   "es": "El hospital principal, con servicio de urgencias",
   "ko": "응급실이 있는 주요 병원",
   "ja": "主要病院、救急科あり"
  },
  "src": "official",
  "v": "2026-10",
  "alias": [
   "医院",
   "大医院",
   "急诊",
   "병원",
   "応急",
   "病院",
   "hôpital",
   "hospital",
   "ER",
   "emergency",
   "emergency room",
   "urgences",
   "emergencias",
   "응급실",
   "救急"
  ],
  "id": "1e3e329a"
 },
 {
  "n": "North Shore Urgent Care (UPCC)",
  "c": "hospital",
  "g": "ns",
  "lat": 50.6964889,
  "lng": -120.3589069,
  "a": "700 Tranquille Rd #21-22",
  "p": "250-314-2256",
  "h": {
   "r": [
    [
     1,
     7,
     450,
     1110,
     0
    ]
   ]
  },
  "note": {
   "zh": "⭐无家庭医生也可用",
   "en": "⭐ Can be used without a family doctor",
   "fr": "⭐ Accessible sans médecin de famille",
   "es": "⭐ Se puede usar sin médico de familia",
   "ko": "⭐ 가정의가 없어도 이용 가능",
   "ja": "⭐かかりつけ医がいなくても利用可能"
  },
  "src": "official",
  "v": "2026-10",
  "alias": [
   "急诊",
   "walk in",
   "walkin",
   "급한",
   "急患",
   "walk in clinic",
   "walk-in clinic",
   "walk-in",
   "clinique sans rendez-vous",
   "clínica sin cita",
   "无需预约的诊所",
   "免预约诊所",
   "워크인 클리닉",
   "ウォークインクリニック"
  ],
  "id": "b29c9af7",
  "w": "https://www.interiorhealth.ca/locations/kamloops-north-shore-urgent-and-primary-care-centre-upcc"
 },
 {
  "n": "Riverside Dental",
  "c": "dental",
  "g": "sk",
  "lat": 50.6760255,
  "lng": -120.3304891,
  "a": "444 Victoria St #307",
  "p": "250-372-1237",
  "h": {
   "r": [
    [
     1,
     5,
     450,
     990,
     0
    ]
   ]
  },
  "note": {
   "zh": "⭐提供当天牙科急诊预约，请先给诊所打电话",
   "en": "⭐ Offers same-day emergency appointments; call the office first",
   "fr": "⭐ Offre des rendez-vous d'urgence le jour même ; appelez d'abord le cabinet",
   "es": "⭐ Ofrece citas de urgencia el mismo día; llame primero a la clínica",
   "ko": "⭐ 당일 치과 응급 예약 가능, 먼저 치과에 전화하세요",
   "ja": "⭐歯科の当日急患予約に対応。まず医院に電話を"
  },
  "src": "official",
  "v": "2026-10",
  "id": "172f9aae",
  "w": "https://www.riversidedentalclinic.ca/"
 },
 {
  "n": "Kamloops Veterinary Clinic",
  "c": "vet",
  "g": "sa",
  "lat": 50.66119,
  "lng": -120.3633117,
  "a": "1370B Dalhousie Dr",
  "p": "250-374-1485",
  "h": {
   "r": [
    [
     1,
     6,
     480,
     1020,
     0
    ]
   ]
  },
  "note": {
   "zh": "⭐口碑极佳，周六也营业",
   "en": "⭐ Excellent reputation; open Saturdays too",
   "fr": "⭐ Excellente réputation; ouvert aussi le samedi",
   "es": "⭐ Excelente reputación; también abre los sábados",
   "ko": "⭐ 평판이 매우 좋고 토요일에도 영업",
   "ja": "⭐評判が非常に良く、土曜も営業"
  },
  "src": "official",
  "v": "2026-10",
  "id": "08c3204e",
  "w": "https://kamloopsveterinaryclinic.com/"
 },
 {
  "n": "Shoppers Drug Mart (Summit)",
  "c": "pharmacy",
  "g": "sa",
  "lat": 50.665217,
  "lng": -120.3522333,
  "a": "1210 Summit Dr",
  "p": "250-374-0477",
  "w": "https://www.shoppersdrugmart.ca/en/stores/277-shoppers-drug-mart-columbia-place/",
  "h": {
   "r": [
    [
     1,
     7,
     480,
     1320,
     0
    ]
   ]
  },
  "note": {
   "zh": "含Canada Post邮局点",
   "en": "Has a Canada Post outlet inside",
   "fr": "Comptoir de Postes Canada à l'intérieur",
   "es": "Tiene un mostrador de Canada Post dentro",
   "ko": "내부에 Canada Post 창구 있음",
   "ja": "店内にCanada Postの窓口あり"
  },
  "src": "official",
  "v": "2026-10",
  "t": [
   "life"
  ],
  "id": "021d4e94"
 },
 {
  "n": "Kamloops RCMP",
  "c": "police",
  "g": "sk",
  "lat": 50.6735493,
  "lng": -120.3276099,
  "a": "560 Battle St",
  "p": "250-828-3000",
  "w": "https://rcmp.ca/en/bc/kamloops",
  "h": {
   "r": [
    [
     1,
     5,
     510,
     990,
     0
    ]
   ]
  },
  "note": {
   "zh": "非紧急；紧急拨911",
   "en": "Non-emergency line; call 911 in an emergency",
   "fr": "Ligne non urgente; composez le 911 en cas d'urgence",
   "es": "Línea no urgente; llame al 911 en una emergencia",
   "ko": "비응급 전화, 긴급 상황에는 911",
   "ja": "非緊急用、緊急時は911"
  },
  "src": "official",
  "v": "2026-10",
  "id": "6cf9171d"
 },
 {
  "n": "Canada Games Aquatic Centre",
  "c": "pool",
  "g": "sa",
  "lat": 50.6684041,
  "lng": -120.3659327,
  "a": "910 McGill Rd",
  "p": "250-828-3655",
  "w": "https://www.kamloops.ca/recreation-culture/aquatics/pool-facilities",
  "h": {
   "k": "hSite"
  },
  "note": {
   "zh": "⭐50m八道室内泳池、1m/3m跳板和5m跳台、滑梯、休闲池、带无障碍升降椅的按摩池、桑拿和蒸汽房。位于TCC内，同楼有健身房、200米室内跑道和体操馆。所有使用者都需要一个市政府康乐账户（City Recreation Account）",
   "en": "⭐ 50 m eight-lane indoor pool, 1 m and 3 m diving boards and a 5 m tower, a waterslide, a leisure pool, a hot tub with an accessible lift, sauna and steam room. Inside the TCC, which also has a gym, a 200 m indoor track and a gymnastics facility. Every user needs a City Recreation Account",
   "fr": "⭐ Bassin intérieur de 50 m à huit couloirs, tremplins de 1 et 3 m et tour de 5 m, glissade d'eau, bassin récréatif, bain à remous avec lève-personne, sauna et hammam. Dans le TCC, qui abrite aussi un gym, une piste intérieure de 200 m et une salle de gymnastique. Chaque usager doit avoir un compte City Recreation Account",
   "es": "⭐ Piscina cubierta de 50 m con ocho carriles, trampolines de 1 y 3 m y torre de 5 m, tobogán, piscina recreativa, jacuzzi con elevador accesible, sauna y baño de vapor. Dentro del TCC, que también tiene gimnasio, pista cubierta de 200 m y sala de gimnasia. Todos los usuarios necesitan una City Recreation Account",
   "ko": "⭐ 50m 8레인 실내 수영장, 1m·3m 다이빙 보드와 5m 다이빙 타워, 워터슬라이드, 레저풀, 장애인용 리프트가 있는 온수풀, 사우나와 증기실. 헬스장·200m 실내 트랙·체조장이 있는 TCC 안에 있음. 이용자는 모두 시 레크리에이션 계정(City Recreation Account)이 필요",
   "ja": "⭐50m8コース室内プール、1m・3m飛び板と5m飛び込み台、ウォータースライド、レジャープール、昇降リフト付きジャグジー、サウナ、スチームルーム。ジム、200m屋内トラック、体操施設もあるTCC内。利用者は全員、市のレクリエーションアカウント（City Recreation Account）が必要"
  },
  "src": "official",
  "v": "2026-10",
  "t": [
   "family",
   "fun",
   "indoor"
  ],
  "tag": "tInTCC",
  "e": "swim@kamloops.ca",
  "id": "dc0b303d"
 },
 {
  "n": "Riverside Park Water Park",
  "c": "splash",
  "g": "sk",
  "lat": 50.6787601,
  "lng": -120.337181,
  "a": "100 Lorne St",
  "p": "250-828-3311",
  "h": {
   "r": [
    [
     1,
     7,
     600,
     1260,
     0
    ]
   ],
   "se": "summer",
   "q": "qSeasonSite"
  },
  "note": {
   "zh": "⭐Riverside Park 的无障碍戏水公园，紧邻融合式儿童游乐场；Riverside 停车收费。和 Westsyde Centennial Park 的戏水公园不是同一个",
   "en": "⭐ Riverside Park's accessible water park, right beside the inclusive playground; parking at Riverside is paid. Not the same as the water park in Westsyde Centennial Park",
   "fr": "⭐ Les jeux d'eau accessibles du parc Riverside, juste à côté du terrain de jeu inclusif ; stationnement payant à Riverside. À ne pas confondre avec les jeux d'eau du parc Westsyde Centennial",
   "es": "⭐ El parque acuático accesible de Riverside Park, justo al lado de la zona de juegos inclusiva; el estacionamiento en Riverside es de pago. No es el mismo que el parque acuático de Westsyde Centennial Park",
   "ko": "⭐ Riverside Park의 무장애 물놀이 시설로, 통합 놀이터 바로 옆. Riverside 주차는 유료. Westsyde Centennial Park의 물놀이 시설과는 다른 곳",
   "ja": "⭐Riverside Parkのバリアフリー水遊び場、インクルーシブ・プレイグラウンドのすぐ隣。Riversideの駐車場は有料。Westsyde Centennial Parkの水遊び場とは別の場所"
  },
  "src": "official",
  "v": "2026-10",
  "t": [
   "family",
   "fun",
   "free"
  ],
  "pq": "pCity",
  "id": "dd819a8a",